docid,firstpub,date,birthdate,recept,tags,enumcron,nationality,gender,author,title
njp.32101067178242,1853,1853,1853,,fic,,,,"Thackeray, William Makepeace,","A shabby genteel story, and other tales"
wu.89065914467,1853,1853,1853,,bio,<blank>,,,"Weed, Edward,",Faith and works
nyp.33433082420021,1853,1853,1853,,bio,<blank>,,,"Moore, George C.","The life of Alexander Carson, L.L.D"
nyp.33433070296318,1853,1853,1853,,bio,<blank>,,,"Gavazzi, Alessandro,",Father Gavazzi's lectures in New York
loc.ark+=13960=t57d37g75,1853,1853,1853,,bio,<blank>,,,"Hopkins, Mark,",A discourse commemorative of Amos Lawrence
wu.89076998608,1853,1853,1853,,bio,<blank>,,,"Medberry, Rebecca B. Stetson,","Memoir of Mrs. Sarah Emily York, formerly Miss S.E. Waldo;"
njp.32101066134964,1853,1853,1853,,bio,<blank>,,,"Stork, Theophilus,",The children of the New Testament
loc.ark+=13960=t33201q3h,1853,1853,1853,,bio,<blank>,,,"Botts, John Minor,","Speech of the Hon. John Minor Botts, delivered on the occasion of a complementary dinner, at Newark, N. J., on the 19th of September, 1853"
nyp.33433082536784,1853,1853,1853,,bio,v. 3,,,"Cunningham, George Godfrey.",A history of England in the lives of Englishmen
loc.ark+=13960=t9g44t375,1853,1853,1853,,bio,<blank>,,,"Clayton, John Middleton,","Speech of the Hon. John M. Clayton, delivered at a public dinner given to him at Wilmington, on the 16th November, 1850"
uc1.b4457120,1853,1853,1853,,bio,v.2,,,"Haydon, Benjamin Robert,","Life of Benjamin Robert Haydon, historical painter, from his autobiography and journals"
mdp.39015033869051,1853,1853,1853,,bio,ser.2 v.2,,,"Sparks, Jared,",The library of American biography
yale.39002007705933,1853,1853,1853,,bio,<blank>,,,"Croswell, Harry,","A memoir of the late Rev. William Croswell, D.D"
uc2.ark+=13960=t21c1vq9x,1853,1853,1853,,bio,<blank>,,,"Whiting, Sydney.",Memoirs of a stomach
njp.32101067176055,1854,1854,1854,,fic,,,,"Sherwood,","The history of the Fairchild family; or, The child's manual"
uc1.b3327459,1854,1854,1854,,fic,v.1-2,,,"Whyte-Melville, G. J.",Tilbury Nogo;
uc1.b307246,1854,1854,1854,,fic,v.3,,,"Haliburton, Thomas Chandler,",The Americans at home;
uva.x000597491,1854,1854,1854,,fic,,,,"Simms, William Gilmore,",Woodcraft
uc2.ark+=13960=t1zc7w00z,1854,1854,1854,,fic,,,,"Blox, John E.","Justo Ucundono, prince of Japan"
dul1.ark+=13960=t8pc3qq26,1854,1854,1854,,fic,v.3,,,"Gore,",Progress and prejudice
njp.32101068142015,1854,1854,1854,,fic,v.1,,,"Linden, Liele.",Chestnut wood
uc1.b257083,1854,1854,1854,,fic,,,,"Chouquet, Gustave",Easy conversations in French
wu.89077021418,1854,1854,1854,,bio,<blank>,,,"Yale, Cyrus,",The godly pastor
nyp.33433000988612,1854,1854,1854,,bio,v. 2,,,"Headley, Joel Tyler,",Washington and his generals
uc2.ark+=13960=t6f18v60w,1854,1854,1854,,bio,v.1,,,"Hanna, William,",Memoirs of Thomas Chalmers
wu.89077004406,1854,1854,1854,,bio,<blank>,,,"Henkle, M. M.",The life of Henry Bidleman Bascom
uc1.32106009344414,1854,1854,1854,,bio,v.1,,,"Herring, James,",The national portrait gallery of distinguished Americans: with biographical sketches
mdp.49015002906775,1854,1854,1854,,bio,v.4,,,"Herring, James,",The national portrait gallery of distinguished Americans
uc2.ark+=13960=t4zg6kj4t,1854,1854,1854,,bio,v.07,,,"Stewart, Dugald,",The collected works of Dugald Stewart
mdp.39015033443964,1854,1854,1854,,bio,<blank>,,,"Napier, William Francis Patrick,",Comments upon a memorandum of the Duke of Wellington and other documents censuring Lieut.-General Charles James Napier
mdp.39015063635240,1855,1855,1855,,fic,v.2,,,"Gordon-Cumming, Roualeyn,",Five years of a hunter's life in the far interior of South Africa. With anecdotes of the chase and notices of the native tribes
uc2.ark+=13960=t9n29qj04,1855,1855,1855,,fic,v.1,,,"Reid, Mayne,",The white chief
uc1.b287357,1855,1855,1855,,fic,,,,"Ellis, Sarah Stickney,","My brother, or, The man of many friends"
uc2.ark+=13960=t5k932p1z,1855,1855,1855,,fic,,,,"Leslie, Madeline,",The first and the second marriages;
uc1.b272927,1855,1855,1855,,fic,,,,,The Ladies' wreath
uiuo.ark+=13960=t2v41083w,1855,1855,1855,,fic,v.2,,,"Armstrong, F. Claudius.",The warhawk
uc2.ark+=13960=t6251g703,1855,1855,1855,,fic,,,,"Pratt, L. J.",The unfortunate mountain girl
uc1.b3327324,1855,1855,1855,,fic,,,,"Moodie, Susanna,",Geoffrey Moncton
uc1.b3575955,1855,1855,1855,,bio,v.1,,,"Smith, Sydney,",A memoir of the Reverend Sydney Smith
inu.32000010022269,1855,1855,1855,,bio,v.8,,,"Cunningham, George Godfrey.",A history of England in the lives of Englishmen
nyp.33433069122517,1855,1855,1855,,bio,<blank>,,,"Manship, Andrew,",Thirteen years' experience in the itinerancy
njp.32101072900200,1855,1855,1855,,bio,<blank>,,,"Hart, John S.",The female prose writers of America
wu.89096171046,1855,1855,1855,,bio,v.2,,,"Abbott, John S. C.",The history of Napoleon Bonaparte
wu.89097319586,1855,1855,1855,,bio,v.1,,,"Braithwaite, J. Bevan",Memoirs of Joseph John Gurney;
uc2.ark+=13960=t9n29q671,1855,1855,1855,,bio,v.1,,,"Belknap, Jeremy,",American biography
uc2.ark+=13960=t47p8w13n,1856,1856,1856,,fic,,,,"Urbino, L. B.",The home angel
uc2.ark+=13960=t12n5040x,1856,1856,1856,,fic,,,,"Reid, Mayne,",The bush-boys;
uc2.ark+=13960=t57d2s689,1856,1856,1856,,fic,v.003,,,"Hubback,",The old vicarage
nnc1.cu11683260,1856,1856,1856,,fic,v.9,,,"Cooper, James Fenimore,",Cooper's sea tales
mdp.39015071556180,1856,1856,1856,,bio,<blank>,,,"Giles, Daphne S.","Vera; or, Obstacles surmounted"
loc.ark+=13960=t8mc91s5x,1856,1856,1856,,bio,<blank>,,,<blank>,Life of Millard Fillmore
uc1.b4071085,1856,1856,1856,,bio,v.2,,,"Napier, Mark,",Memoirs of the Marquis of Montrose
uc2.ark+=13960=t7wm17d52,1856,1856,1856,,bio,v.1,,,"Vehse, Carl Eduard,","Memoirs of the court, aristocracy, and diplomacy of Austria"
yale.39002013450755,1856,1856,1856,,bio,<blank>,,,"Thomson, E.",Sketches biographical and incidental
uva.x002008675,1856,1856,1856,,bio,v.2,,,"Lewes, George Henry,",The life and works of Goethe
uc1.b99703,1856,1856,1856,,bio,<blank>,,,"Hillard, George Stillman,",A memoir of James Brown
uc2.ark+=13960=t40r9tf4k,1857,1857,1857,,fic,v.11,,,"Wilson, John Mackay,",Wilson's tales of the borders and of Scotland
mdp.39015059373046,1857,1857,1857,,fic,v.1-2,,,"Wilson, John Mackay,","Wilson's tales of the borders, and of Scotland"
uc1.b4102978,1857,1857,1857,,fic,,,,"Ballantyne, R. M.",Ungava
uiuo.ark+=13960=t4wh36k87,1857,1857,1857,,fic,v.3,,,,The second wife
nyp.33433081801700,1857,1857,1857,,bio,<blank>,,,"Jenkins, John S.",Daring deeds of American generals
loc.ark+=13960=t9z036m2m,1857,1857,1857,,bio,<blank>,,,"Holbrook, Samuel F.,",Threescore years
nyp.33433082334271,1857,1857,1857,,bio,<blank>,,,"Cone, Edward Winfield,",The life of Spencer H. Cone
mdp.39015066358394,1857,1857,1857,,bio,v.4,,,"Saint-Simon, Louis de Rouvroy,",The memoirs of the Duke of Saint Simon on the reign of Louis XIV. and the regency;
uiuo.ark+=13960=t19k4q55k,1858,1858,1858,,fic,v.3,,,,"Eva Desmond, or, Mutation"
uc2.ark+=13960=t7np22q3z,1858,1858,1858,,fic,v.1,,,"Gore,",Heckington;
uc1.b3328849,1858,1858,1858,,fic,v.7,,,"Scott, Walter,",Waverley novels
nnc1.1002213257,1858,1858,1858,,fic,,,,"Ram, Stopford James,",Greatness in little things
uc1.b4071025,1858,1858,1858,,bio,v.2,,,"Campbell, John Campbell,",The lives of the chief justices of England
nyp.33433082348008,1858,1858,1858,,bio,v. 2,,,"Metcalfe, Charles Theophilus Metcalfe,","The life and correspondence of Charles, Lord Metcalfe"
nyp.33433082397088,1858,1858,1858,,bio,<blank>,,,"Headley, Joel Tyler,",The illustrated life of Washington
uc1.b282537,1858,1858,1858,,bio,<blank>,,,"Henson, Josiah,",Father Henson's story of his own life
nyp.33433070292655,1858,1858,1858,,bio,<blank>,,,"Adams, Charles,",Words that shook the world;
uc1.b3339539,1858,1858,1858,,bio,v. 2,,,"Hogg, Thomas Jefferson,",The life of Percy Bysshe Shelley
loc.ark+=13960=t5m90b23b,1858,1858,1858,,bio,<blank>,,,"Blair, Francis Preston,","Speech of Hon. Francis P. Blair, jr., of Missouri, on the acquisition of Central America;"
loc.ark+=13960=t3029668r,1858,1858,1858,,bio,<blank>,,,"Hughes, James,",Lecompton constitution
nyp.33433076016918,1859,1859,1859,,fic,v. 23,,,"Cooper, James Fenimore,",Cooper's novels
nyp.33433074829049,1859,1859,1859,,fic,,,,"Bennett, Emerson,",Wild scenes on the frontiers;
uc2.ark+=13960=t0ms3ms44,1859,1859,1859,,fic,v.31,,,"Lytton, Edward Bulwer Lytton,",Novels of Sir Edward Bulwer Lytton
nyp.33433074797659,1859,1859,1859,,fic,v. 2,,,"Fletcher, Miriam.",The Methodist
uva.x000473526,1859,1859,1859,,fic,v.25,,,"Cooper, James Fenimore,",Cooper's novels
njp.32101065203703,1859,1859,1859,,fic,vol.2,,,"Piddington, Rose.",The last of the Cavaliers
uva.x001048929,1859,1859,1859,,fic,,,,"Asbjørnsen, Peter Christen,",Popular tales from the Norse
uc1.b29359,1859,1859,1859,,bio,<blank>,,,"Chadwick, William.",The life and times of Daniel De Foe
yale.39002060927275,1859,1859,1859,,bio,<blank>,,,"Griswold, Rufus W.","The republican court, or, American society in the days of Washington"
nyp.33433082397039,1859,1859,1859,,bio,<blank>,,,"Custis, George Washington Parke,",Recollections and private memoirs of Washington
ncs1.ark+=13960=t1hh75p31,1859,1859,1859,,bio,1859,,,"French, Gilbert James,","The life and times of Samuel Crompton, inventor of the spinning machine called the mule"
wu.89097025746,1859,1859,1859,,bio,<blank>,,,<blank>,Biography and history
nyp.33433075753537,1860,1860,1860,,fic,v. 2,,,"Stretton, Julia Cecilia,",The valley of a hundred fires
nyp.33433076060791,1860,1860,1860,,fic,v. 2,,,"Warfield, Catherine Ann Ware,",The household of Bouverie
loc.ark+=13960=t2x351903,1860,1860,1860,,fic,,,,"Gilbert, John,","The curious adventures, painful experience, and laughable difficulties of a man of letters while traveling as a peddler in the South during the late Harper's Ferry excitement"
loc.ark+=13960=t8gf0x21c,1860,1860,1860,,bio,<blank>,,,"Ferry, Orris Sanford,","Speech of Orris S. Ferry, of Connecticut"
yale.39002008744360,1860,1860,1860,,bio,<blank>,,,"Watson, J. S.","The life of George Fox, the founder of the Quakers"
uiuo.ark+=13960=t17m09d4g,1860,1860,1860,,bio,<blank>,,,"Scripps, J. L.",Life of Abraham Lincoln
uc2.ark+=13960=t0sq8r18m,1860,1860,1860,,bio,<blank>,,,"Redpath, James,",The public life of Captain John Brown
njp.32101066458041,1860,1860,1860,,bio,<blank>,,,"Johnston, Algernon Sidney,",Memoirs of a nullifier
njp.32101076517315,1860,1860,1860,,bio,<blank>,,,"Bolton, Rhoda.","The lighted valley, or, The closing scenes in the life of a beloved sister"
nyp.33433082379862,1860,1860,1860,,bio,<blank>,,,"Lossing, Benson John,",The life and times of Philip Schuyler
uiuo.ark+=13960=t4sj24h91,1861,1861,1861,,fic,v.2,,,"Radecliffe, Noell.",Wheel within wheel
uiuo.ark+=13960=t7qn6pv8d,1861,1861,1861,,fic,v.3,,,"Oliphant,",The house on the moor
yale.39002014367461,1861,1861,1861,,bio,v.1,,,"Stanhope, Philip Henry Stanhope,",Life of the Right Honourable William Pitt
loc.ark+=13960=t2w386w6h,1861,1861,1861,,bio,<blank>,,,"Palmer, Robert M.,",Washington and the union
loc.ark+=13960=t47p9d118,1861,1861,1861,,bio,<blank>,,,"Washington, George,","Gen. Washington on the government of the United States of America and on revolution, etc"
njp.32101067174092,1861,1861,1861,,bio,v.1,,,"Lockhart, J. G.","Memoirs of the life of Sir Walter Scott, Bart"
mdp.39015028186636,1861,1861,1861,,bio,v.2,,,"Buckingham and Chandos, Richard Plantagenet Temple Nugent Brydges Chandos Grenville,",Memoirs of the courts and cabinets of William IV. and Victoria
uc1.b2969506,1861,1861,1861,,bio,v. 10,,,"Hook, Walter Farquhar,",Lives of the archbishops of Canterbury
mdp.39015016436506,1861,1861,1861,,bio,v.6,,,"Lockhart, J. G.","Memoirs of the life of Sir Walter Scott, bart"
nc01.ark+=13960=t3xs63v71,1862,1862,1862,,fic,,,,"Fanny,",The orphan's home mittens; and George's account of the battle of Roanoke Island
wu.89099774549,1862,1862,1862,,fic,,,,,The cobler of Canterburie
nyp.33433074864848,1862,1862,1862,,fic,,,,"Gore,",The royal favourite
inu.32000003226448,1862,1862,1862,,fic,v.2,,,"Jean Paul,",Titan
njp.32101068601010,1862,1862,1862,,fic,,,,"Martineau, Harriet,",Homes abroad
loc.ark+=13960=t6542v98c,1862,1862,1862,,bio,<blank>,,,"Butler, William Allen,",Martin Van Buren
loc.ark+=13960=t4kk9dm2f,1862,1862,1862,,bio,<blank>,,,"Voorhees, Daniel Wolsey,","Speech of Hon. D. W. Voorhees, of Indiana"
dul1.ark+=13960=t50g4f66g,1863,1863,1863,,fic,,,,"Lytton, Edward Bulwer Lytton,",A strange story
uiuo.ark+=13960=t4dn4h40p,1863,1863,1863,,fic,v.1,,,"Drury, Anna H.",Deep waters
uiuo.ark+=13960=t3vt1z83n,1863,1863,1863,,fic,v.1,,,"Collins, Charles James,",Sackville chase
uiuo.ark+=13960=t3514km42,1863,1863,1863,,fic,v.1,,,"Kavanagh, Julia.",Queen Mab
uiuo.ark+=13960=t19k4n86k,1863,1863,1863,,fic,v.2,,,"Collins, Charles James,",Sackville chase
uiuo.ark+=13960=t04x5m49t,1863,1863,1863,,fic,v.3,,,"Clarke, Charles.",Charlie Thornhill;
nc01.ark+=13960=t7pn9kj22,1863,1863,1863,,fic,,,,"Hazelton, Harry.","The border spy, or, The beautiful captive of the rebel camp"
njp.32101035036084,1863,1863,1863,,fic,,,,,Kenny Carle's uniform
njp.32101063603581,1863,1863,1863,,fic,,,,"Barrow, Frances Elizabeth Mease,",The new night-caps
nnc1.0040558800,1863,1863,1863,,bio,v.2,,,"Prescott, William Hickling,",History of the conquest of Mexico
loc.ark+=13960=t2794d923,1863,1863,1863,,bio,<blank>,,,"Perry, Aaron F.",Argument of Hon. Aaron F. Perry
uc2.ark+=13960=t9d50jg13,1863,1863,1863,,bio,<blank>,,,"Poel, Emma.",Life of Amelia Wilhelmina Sieveking
loc.ark+=13960=t1jh46z74,1863,1863,1863,,bio,<blank>,,,"Bishop, Albert Webb.",Loyalty on the frontier
nnc2.ark+=13960=t05x2cs3q,1863,1863,1863,,bio,v. 3 [1863-68],,,"Cunningham, George Godfrey.",The English nation;
loc.ark+=13960=t4sj1w827,1863,1863,1863,,bio,<blank>,,,"Alexander, Charles Wesley,",The volunteers' roll of honor
uc1.b268677,1863,1863,1863,,bio,<blank>,,,"Artman, Wm.",Beauties and achievements of the blind
nyp.33433082215819,1863,1863,1863,,bio,v. 9 (FIL-GAY),,,<blank>,The Imperial dictionary of universal biography
uiuo.ark+=13960=t1sf3cb0v,1864,1864,1864,,fic,v.3,,,"Locker, Arthur,",Sir Goodwin's folly
uc1.b3550702,1864,1864,1864,,fic,,,,"Jeaffreson, John Cordy,",Olive Blake's good work
uiuo.ark+=13960=t9p27hj5m,1864,1864,1864,,fic,v.2,,,"Saunders, John,",Guy Waterman
nyp.33433074970520,1864,1864,1864,,fic,,,,Author of Chronicles of the Schonberg-Cotta family.,Diary of Mrs. Kitty Trevylyan
nyp.33433069242224,1864,1864,1864,,fic,,,,"Hillard, George Stillman,",The third reader
mdp.39015002683467,1864,1864,1864,,bio,<blank>,,,<blank>,Mai-jour (translated May-day) General George Barnum McClellan
loc.ark+=13960=t9v12n278,1864,1864,1864,,bio,<blank>,,,"Scott, Walter,","The poetical works of Sir Walter Scott, bart"
dul1.ark+=13960=t3b00011n,1864,1864,1864,,bio,<blank>,,,"Burrows, J. Lansing",The Christian scholar and soldier
mdp.49015002584929,1865,1865,1865,,fic,,,,"Wilson, John,",The recreations of Christopher North
nyp.33433081938411,1865,1865,1865,,fic,,,,"Savage, William T.,",Miramichi
loc.ark+=13960=t6d22dg8q,1865,1865,1865,,fic,,,,"Victor, Metta Victoria Fuller,",The two hunters;
uva.x000612137,1865,1865,1865,,fic,v.17,,,"Scott, Walter,",The Waverley novels
uc2.ark+=13960=t4cn70x6h,1865,1865,1865,,fic,v.001,,,"MacDonald, George,",Alec Forbes of Howglen
loc.ark+=13960=t8gf16n5m,1865,1865,1865,,bio,<blank>,,,"Bowman, S. M.",Sherman and his campaigns
loc.ark+=13960=t3mw2js8q,1865,1865,1865,,bio,<blank>,,,"Niles, Henry Edward,",Address of Rev. H. E. Niles
loc.ark+=13960=t6445s14v,1865,1865,1865,,bio,<blank>,,,<blank>,"Illustrated life, campaigns and public services of Lieut. General Grant"
mdp.39015010966391,1865,1865,1865,,bio,<blank>,,,"Gorman, Samuel.","Abraham Lincoln, late president of the United States, fallen in the defence of his country"
loc.ark+=13960=t8tb17j86,1865,1865,1865,,bio,<blank>,,,"Bain, John Wallace,",National lessons from the life and death of President Lincoln
mdp.39015007886164,1865,1865,1865,,bio,v.1,,,"Mozart, Wolfgang Amadeus,",The letters of Wolfgang Amadeus Mozart (1769-1791) Tr. from the collection of Ludwig Nohl
nyp.33433081688776,1865,1865,1865,,bio,v. 2,,,"Stone, William L.",Life of Joseph Brant
njp.32101075987329,1865,1865,1865,,bio,<blank>,,,"Hewit, Augustine F.",Life of the Rev. Francis A. Baker
loc.ark+=13960=t51g0tf02,1865,1865,1865,,bio,<blank>,,,"Garrison, Joseph Fithian. [from old catalog]",The teachings of the crisis
uiuo.ark+=13960=t2c82xq1b,1866,1866,1866,,fic,v.2,,,Clyffards.,The Clyffards of Clyffe
uc1.b4107427,1866,1866,1866,,fic,,,,"Gaskell, Elizabeth Cleghorn,",Wives and daughters
nyp.33433076057680,1866,1866,1866,,fic,,,,,"Favorite authors, a companion-book of prose and poetry"
nyp.33433082246376,1866,1866,1866,,fic,v. 5 (pt. 2 ),,,"Dickens, Charles,",Bleak house
uiuo.ark+=13960=t7vm4sm4q,1866,1866,1866,,fic,v.2,,,"Maughan, Janet.",The man of mark
uc1.b3326049,1866,1866,1866,,fic,,,,"Smedley, Frank E.",Frank Fairlegh;
uc1.b4101633,1866,1866,1866,,fic,v.3,,,"Eliot, George,",Felix Holt
nyp.33433075767248,1866,1866,1866,,fic,,,,"Whitehead, Trafford,",The Grahames;
yale.39002005758546,1866,1866,1866,,fic,,,,"Estabrooks, Henry L.",Adrift in Dixie;
nyp.33433082361506,1866,1866,1866,,bio,<blank>,,,"Marsh, John,",Temperance recollections
nyp.33433082544754,1866,1866,1866,,bio,<blank>,,,"Dorsey, Sarah A.",Recollections of Henry Watkins Allen
nyp.33433082337332,1866,1866,1866,,bio,<blank>,,,"Ludlow, John Malcolm Forbes,","President Lincoln, self-pourtrayed"
mdp.39015066053763,1866,1866,1866,,bio,v.2,,,"Johnson, Samuel,",Lives of the most eminent English poets
mdp.39015016782529,1866,1866,1866,,bio,v.9,,,"Butler, Alban,","The lives of the fathers, martyrs, and other principal saints"
uc1.b3549034,1867,1867,1867,,fic,,,,"Edwards, Annie,",Archie Lovell
uc2.ark+=13960=t80k29g9z,1867,1867,1867,,fic,,,,"Mühlbach, L.",Louisa of Prussia and her times
inu.30000054101278,1867,1867,1867,,fic,v.3,,,"Marryat, Florence,",The confessions of Gerald Estcourt
njp.32101074878552,1867,1867,1867,,fic,,,,"Scott, Walter,",Rob Roy
uc2.ark+=13960=t2794253n,1867,1867,1867,,fic,,,,"Lawrence, George Alfred,",Guy Livingstone
uc1.b187348,1867,1867,1867,,fic,,,,"Thayer, William Makepeace,","The pioneer boy, and how he became president"
uc2.ark+=13960=t4rj4g518,1867,1867,1867,,fic,,,,"Jerrold, Douglas William,",The story of a feather
uc2.ark+=13960=t56d5rq50,1867,1867,1867,,fic,,,,"Ferguson, Samuel,",Father Tom and the Pope
nyp.33433076079627,1867,1867,1867,,fic,,,,"Preston, Laura,",In bonds
uc2.ark+=13960=t1hh6dj5q,1867,1867,1867,,fic,,,,"Kemble, Adelaide.",A week in a French country-house
loc.ark+=13960=t55d9k948,1867,1867,1867,,bio,<blank>,,,"Swain, David L.",Early times in Raleigh
nyp.33433082359534,1867,1867,1867,,bio,v. 2,,,"Pepys, Samuel,",Diary and correspondence of Samuel Pepys
nyp.33433061845768,1867,1867,1867,,bio,<blank>,,,"Beard, Richard,",Brief biographical sketches of some of the early ministers of the Cumberland Presbyterian Church
mdp.39015027329765,1867,1867,1867,,bio,?v?,,,"Wellington, Arthur Wellesley,","Despatches, correspondence, and memoranda of Field Marshall Arthur, duke of Wellington, K.G"
mdp.39015021302784,1867,1867,1867,,bio,<blank>,,,"Smiles, Samuel,","The life of Thomas Telford, civil engineer"
loc.ark+=13960=t0jt0js0z,1867,1867,1867,,bio,<blank>,,,"Moore, Thomas,",The poetical works of Thomas Moore
mdp.39015063024320,1867,1867,1867,,bio,v.2,,,"Lonsdale, Henry,",The worthies of Cumberland
uc2.ark+=13960=fk0cv4bs2c,1867,1867,1867,,bio,<blank>,,,"Mudge, Zachariah Atwell,",The forest boy
uc2.ark+=13960=t57d2qw7z,1868,1868,1868,,fic,,,,,"The Canterbury bells; or, Scenes in the Belmont family"
uva.x030802592,1868,1868,1868,,fic,,,,"Follen, Eliza Lee Cabot,",May morning and New Year's Eve
nc01.ark+=13960=t1fj2vj0w,1868,1868,1868,,fic,,,,"Beecher, Henry Ward,",Norwood;
nyp.33433074859418,1868,1868,1868,,fic,,,,"Greenwood, James.",The bear king
uc1.b3327263,1868,1868,1868,,fic,v. 1,,,"Yonge, Charlotte M.",The chaplet of pearls;
uc2.ark+=13960=t1jh3g53t,1868,1868,1868,,fic,,,,"Valentine, L.",Eastern tales
nc01.ark+=13960=t9f48335q,1868,1868,1868,,fic,,,,"Dickinson, Anna E.",What answer?
uc1.b4104681,1868,1868,1868,,fic,v.2,,,"Brooks, Shirley,",Sooner or later
yale.39002068984732,1868,1868,1868,,bio,<blank>,,,"Kitto, John,",Illustrated history of the Holy Bible
nyp.33433082337209,1868,1868,1868,,bio,<blank>,,,"Bisbee, Herman.",Memoir of Rev. Seth Barnes
nyp.33433082359351,1868,1868,1868,,bio,v. 3,,,"Badeau, Adam,",Military history of Ulysses S. Grant
loc.ark+=13960=t2t43sc6n,1868,1868,1868,,bio,<blank>,,,"Wilson, James Grant,",The life and campaigns of Ulysses Simpson Grant
loc.ark+=13960=t6349d28w,1868,1868,1868,,bio,<blank>,,,"Lanman, Charles,",Dictionary of the United States Congress
umn.31951002405324i,1868,1868,1868,,bio,<blank>,,,"Hugo, Thomas,",The Bewick collector
wu.89097348346,1868,1868,1868,,bio,<blank>,,,"Sainte-Beuve, Charles Augustin,",Portraits of celebrated women
uc1.b250573,1869,1869,1869,,fic,v. 3,,,"Tabor, Eliza.",Meta's faith
uiuo.ark+=13960=t6k07g132,1869,1869,1869,,fic,v.2,,,"Gibbon, Charles,",Robin Gray
mdp.39015078570580,1869,1869,1869,,fic,,,,"Belisle, D. W.",The American family Robinson;
njp.32101068169422,1869,1869,1869,,fic,vol.1,,,"Fullerton, Georgiana,",Mrs. Gerald's niece
wu.89099962912,1869,1869,1869,,bio,<blank>,,,"Forster, John,",Walter Savage Landor
uva.x000764723,1869,1869,1869,,bio,v.1,,,"Lockhart, J. G.",Memoirs of Sir Walter Scott
nyp.33433082409503,1869,1869,1869,,bio,<blank>,,,"Gibbon, Edward,","The autobiography and correspondence of Edward Gibbon, the historian"
uc1.b50005,1869,1869,1869,,bio,<blank>,,,"Browne, Junius Henri,","The great metropolis, a mirror of New York"
mdp.39015041114771,1869,1869,1869,,bio,<blank>,,,"Southall, Eliza Allen,","A brief memoir with portions of the diary, letters, and other remains, of Eliza Southall"
mdp.39015027747685,1869,1869,1869,,bio,v.2,,,"Barnes, William Horatio.",The Fortieth Congress of the United States
wu.89073054082,1869,1869,1869,,bio,<blank>,,,"Neill, Edward D.",Pocahontas and her companions
nyp.33433082359757,1869,1869,1869,,bio,<blank>,,,<blank>,In memoriam; Mary Elizabeth Perry
nyp.33433082394846,1869,1869,1869,,bio,<blank>,,,"Molyneux, Georgina.",The curé d'Ars
nyp.33433006518959,1870,1870,1870,,fic,,,,"Bungay, George W.",Temperance anecdotes. Original and selected
nyp.33433074861828,1870,1870,1870,,fic,,,,"Durivage, Francis A.","The three brides, Love in a cottage, and other tales"
uc1.b111886,1870,1870,1870,,fic,,,,"De Mille, James,",The lady of the ice
nyp.33433075770275,1870,1870,1870,,fic,v. 2,,,"Wood, Henry,",George Canterbury's will
uc2.ark+=13960=t54f1n16g,1870,1870,1870,,fic,,,,"Brewster, Anne Maria Hampton,","Compensation; or, Always a future"
mdp.39015078559484,1870,1870,1870,,fic,,,,"Defoe, Daniel,",Aventures de Robinson Crusoe
nnc1.cu11683538,1870,1870,1870,,fic,v.29,,,"Cooper, James Fenimore,",[Cooper's novels]
nyp.33433082302898,1870,1870,1870,,fic,,,,"Follen, Eliza Lee Cabot,",True stories about dogs & cats
nyp.33433074937479,1870,1870,1870,,fic,,,,"Disraeli, Benjamin,",Henrietta Temple
uva.x002404077,1870,1870,1870,,bio,v.2,,,"Mitford, Mary Russell,",The life of Mary Russell Mitford
mdp.39015013750107,1870,1870,1870,,bio,v.1,,,"Johnstone, James Johnstone,",Memoirs of the Chevalier de Johnstone
mdp.39015071134558,1870,1870,1870,,bio,<blank>,,,"Parker, Henry,",Autobiography of Henry Parker
wu.89099334476,1870,1870,1870,,bio,v.2,,,"Lamington, Alexander Dundas Ross Wishart Cochrane-Baillie,","Francis the First, and other historic studies"
mdp.39015006960408,1870,1870,1870,,bio,v.1,,,"Malmesbury, James Harris,",A series of letters of the first Earl of Malmesbury
uc2.ark+=13960=t7br8nx9r,1870,1870,1870,,bio,v.2,,,"Jones, Bence,",The life and letters of Faraday
njp.32101041062835,1870,1870,1870,,bio,v.1,,,"Husack, John,",Mary queen of Scots and her accusers;
loc.ark+=13960=t3bz68n7v,1870,1870,1870,,bio,<blank>,,,"Barnes, William Horatio.",The Fortieth Congress of the United States
wu.89098854961,1870,1870,1870,,bio,<blank>,,,<blank>,Services at the ordination and installation of Rev. Phebe A. Hanaford
nyp.33433082497391,1870,1870,1870,,bio,v. 5-6,,,"Knight, Charles,",Half-hours with the best authors
nyp.33433074866223,1871,1871,1871,,fic,,,,"James, Marian.","The diamond on the hearth; or, The story of Sister Anne;"
njp.32101067640753,1871,1871,1871,,fic,,,,,The sisters of Orleans
uc1.$b441023,1871,1871,1871,,fic,,,,"Trollope, Anthony,",Sir Harry Hotspur of Humblethwaite
nyp.33433075758882,1871,1871,1871,,fic,,,,"Trollope, Anthony,","Phineas Finn, the Irish member"
uiuo.ark+=13960=t7pn9rd2b,1871,1871,1871,,fic,v.2,,,"Pomeroy, John.",The Scandinavian ring. A novel
njp.32101068141231,1871,1871,1871,,fic,,,,"St. Remy, Dirck.",Stories of the Hudson
inu.39000005767491,1871,1871,1871,,fic,v.1,,,"Redesdale, Algernon Bertram Freeman-Mitford,",Tales of old Japan
uc2.ark+=13960=t84j0j87b,1871,1871,1871,,bio,v.01,,,"Fitzgerald, Percy Hetherington,",The Kembles;
uiuo.ark+=13960=t4hm5hr2p,1872,1872,1872,,fic,v.3,,,"Chatterton, Georgiana,",The lost bride
uc2.ark+=13960=t5fb50m13,1872,1872,1872,,fic,v.11,,,"Lever, Charles James,",[Charles Lever's novels
uc2.ark+=13960=t57d2r61h,1872,1872,1872,,fic,,,,"Sanford, D. P.,",Eunice Somers
nnc1.cu50263471,1872,1872,1872,,fic,,,,"Mühlbach, L.",The daughter of an empress
nyp.33433008836607,1872,1872,1872,,fic,,,,"Warren, Samuel,",Adventures of an attorney in search of practice
uc2.ark+=13960=t72v2f656,1872,1872,1872,,fic,,,,"Southworth, Emma Dorothy Eliza Nevitte,",A noble lord
nyp.33433074902952,1872,1872,1872,,fic,,,,"Maffitt, John Newland,",Nautilus
